{
  "$schema": "http://json-schema.org/draft-07/schema#",
  "$id": "https://ecdat.io/schemas/crypto_vulnerability_catalog.schema.json",
  "title": "ECDAT Cryptographic Vulnerability Catalog Ruleset",
  "description": "Versioned catalog of known cryptographic vulnerabilities in packages and libraries with crypto impact and affected APIs.",
  "type": "object",
  "required": [
    "version",
    "description",
    "last_updated",
    "vulnerabilities"
  ],
  "additionalProperties": false,
  "properties": {
    "version": {
      "type": "string",
      "description": "Semantic version of the vulnerability catalog"
    },
    "description": {
      "type": "string"
    },
    "last_updated": {
      "type": "string"
    },
    "vulnerabilities": {
      "type": "array",
      "items": {
        "type": "object",
        "required": [
          "vulnerability_id",
          "package_name",
          "ecosystem",
          "severity",
          "affected_versions",
          "crypto_impact",
          "summary"
        ],
        "additionalProperties": false,
        "properties": {
          "vulnerability_id": {
            "type": "string",
            "description": "CVE ID or advisory identifier"
          },
          "package_name": {
            "type": "string"
          },
          "ecosystem": {
            "type": "string"
          },
          "severity": {
            "type": "string",
            "enum": ["CRITICAL", "HIGH", "MEDIUM", "LOW", "INFORMATIONAL"]
          },
          "cvss_score": {
            "type": "number",
            "minimum": 0,
            "maximum": 10
          },
          "affected_versions": {
            "type": "string",
            "description": "Semver range or version pattern, e.g. '< 41.0.6'"
          },
          "fixed_versions": {
            "type": "string"
          },
          "crypto_impact": {
            "type": "object",
            "required": [
              "impact_type",
              "affected_crypto_assets",
              "description"
            ],
            "additionalProperties": false,
            "properties": {
              "impact_type": {
                "type": "string",
                "enum": [
                  "KEY_COMPROMISE",
                  "ENCRYPTION_BYPASS",
                  "SIGNATURE_FORGERY",
                  "CERT_VALIDATION_BYPASS",
                  "SIDE_CHANNEL_LEAKAGE",
                  "WEAK_RANDOMNESS",
                  "RCE_IN_HANDSHAKE",
                  "DENIAL_OF_SERVICE",
                  "INFORMATION_DISCLOSURE",
                  "UNKNOWN"
                ]
              },
              "affected_crypto_assets": {
                "type": "array",
                "items": { "type": "string" }
              },
              "description": {
                "type": "string"
              }
            }
          },
          "vulnerable_apis": {
            "type": "array",
            "items": { "type": "string" }
          },
          "summary": {
            "type": "string"
          },
          "advisory_url": {
            "type": "string"
          }
        }
      }
    }
  }
}
