{
  "version": "1.0.0",
  "description": "ECDAT Versioned Cryptographic Vulnerability Catalog mapping library CVEs to crypto impacts, affected assets, and vulnerable APIs.",
  "last_updated": "2026-09-13",
  "vulnerabilities": [
    {
      "vulnerability_id": "CVE-2023-49083",
      "package_name": "cryptography",
      "ecosystem": "pypi",
      "severity": "MEDIUM",
      "cvss_score": 6.5,
      "affected_versions": "< 41.0.6",
      "fixed_versions": ">= 41.0.6",
      "crypto_impact": {
        "impact_type": "DENIAL_OF_SERVICE",
        "affected_crypto_assets": ["PKCS7", "X.509", "Certificate"],
        "description": "Null pointer dereference in PKCS#7 certificate parser causing process crash upon parsing malformed structures."
      },
      "vulnerable_apis": [
        "load_pem_pkcs7_certificates",
        "load_der_pkcs7_certificates"
      ],
      "summary": "cryptography PKCS7 certificate parsing NULL pointer dereference",
      "advisory_url": "https://nvd.nist.gov/vuln/detail/CVE-2023-49083"
    },
    {
      "vulnerability_id": "CVE-2023-23931",
      "package_name": "cryptography",
      "ecosystem": "pypi",
      "severity": "HIGH",
      "cvss_score": 7.5,
      "affected_versions": "< 39.0.1",
      "fixed_versions": ">= 39.0.1",
      "crypto_impact": {
        "impact_type": "KEY_COMPROMISE",
        "affected_crypto_assets": ["AES", "Cipher", "SymmetricEncryption"],
        "description": "Memory corruption via update_into where buffer reuse can overwrite memory or expose plaintext key material."
      },
      "vulnerable_apis": [
        "Cipher.update_into",
        "Cipher"
      ],
      "summary": "cryptography memory corruption in Cipher.update_into",
      "advisory_url": "https://nvd.nist.gov/vuln/detail/CVE-2023-23931"
    },
    {
      "vulnerability_id": "CVE-2020-7788",
      "package_name": "crypto-js",
      "ecosystem": "npm",
      "severity": "MEDIUM",
      "cvss_score": 5.9,
      "affected_versions": "< 4.2.0",
      "fixed_versions": ">= 4.2.0",
      "crypto_impact": {
        "impact_type": "WEAK_RANDOMNESS",
        "affected_crypto_assets": ["PBKDF2", "PasswordHash"],
        "description": "Weak default iteration count and salt handling in PBKDF2 allows accelerated brute force attacks on derived keys."
      },
      "vulnerable_apis": [
        "CryptoJS.PBKDF2"
      ],
      "summary": "crypto-js weak PBKDF2 key derivation iterations",
      "advisory_url": "https://nvd.nist.gov/vuln/detail/CVE-2020-7788"
    },
    {
      "vulnerability_id": "CVE-2022-21449",
      "package_name": "javax.crypto",
      "ecosystem": "maven",
      "severity": "CRITICAL",
      "cvss_score": 9.8,
      "affected_versions": "< 18.0.1",
      "fixed_versions": ">= 18.0.1",
      "crypto_impact": {
        "impact_type": "SIGNATURE_FORGERY",
        "affected_crypto_assets": ["ECDSA", "DigitalSignature", "TLS", "JWT"],
        "description": "Psychic Signatures vulnerability: ECDSA signature verification does not check for r=0 or s=0, allowing complete signature forgery."
      },
      "vulnerable_apis": [
        "Signature.verify",
        "Signature.getInstance"
      ],
      "summary": "Java JCA Psychic Signatures ECDSA verification bypass",
      "advisory_url": "https://nvd.nist.gov/vuln/detail/CVE-2022-21449"
    },
    {
      "vulnerability_id": "CVE-2021-3609",
      "package_name": "bcprov-jdk18on",
      "ecosystem": "maven",
      "severity": "HIGH",
      "cvss_score": 7.5,
      "affected_versions": "< 1.69",
      "fixed_versions": ">= 1.69",
      "crypto_impact": {
        "impact_type": "DENIAL_OF_SERVICE",
        "affected_crypto_assets": ["OpenPGP", "Certificate", "AsymmetricEncryption"],
        "description": "Infinite loop during the parsing of malformed OpenPGP packets leading to Denial of Service."
      },
      "vulnerable_apis": [
        "org.bouncycastle.openpgp.PGPPublicKeyRing",
        "org.bouncycastle.jce.provider.BouncyCastleProvider"
      ],
      "summary": "Bouncy Castle infinite loop in OpenPGP parser",
      "advisory_url": "https://nvd.nist.gov/vuln/detail/CVE-2021-3609"
    },
    {
      "vulnerability_id": "CVE-2022-0778",
      "package_name": "openssl",
      "ecosystem": "native",
      "severity": "HIGH",
      "cvss_score": 7.5,
      "affected_versions": "< 3.0.2",
      "fixed_versions": ">= 3.0.2",
      "crypto_impact": {
        "impact_type": "DENIAL_OF_SERVICE",
        "affected_crypto_assets": ["TLS", "X.509", "Certificate", "BN"],
        "description": "Infinite loop in BN_mod_sqrt() during parsing of certificates with invalid explicit elliptic curve parameters."
      },
      "vulnerable_apis": [
        "BN_mod_sqrt",
        "SSL_connect",
        "SSL_accept",
        "X509_verify"
      ],
      "summary": "OpenSSL infinite loop in BN_mod_sqrt elliptic curve certificate parsing",
      "advisory_url": "https://nvd.nist.gov/vuln/detail/CVE-2022-0778"
    },
    {
      "vulnerability_id": "CVE-2023-38497",
      "package_name": "jsonwebtoken",
      "ecosystem": "npm",
      "severity": "HIGH",
      "cvss_score": 7.5,
      "affected_versions": "< 9.0.0",
      "fixed_versions": ">= 9.0.0",
      "crypto_impact": {
        "impact_type": "SIGNATURE_FORGERY",
        "affected_crypto_assets": ["JWT", "HMAC", "RSA"],
        "description": "Algorithm confusion flaw in jwt.verify allowing HMAC key substitution for RSA public keys to forge tokens."
      },
      "vulnerable_apis": [
        "jwt.verify",
        "jwt.decode"
      ],
      "summary": "jsonwebtoken algorithm confusion signature verification bypass",
      "advisory_url": "https://nvd.nist.gov/vuln/detail/CVE-2023-38497"
    },
    {
      "vulnerability_id": "CVE-2021-38562",
      "package_name": "ring",
      "ecosystem": "crates.io",
      "severity": "MEDIUM",
      "cvss_score": 5.3,
      "affected_versions": "< 0.16.20",
      "fixed_versions": ">= 0.16.20",
      "crypto_impact": {
        "impact_type": "SIDE_CHANNEL_LEAKAGE",
        "affected_crypto_assets": ["AES-GCM", "AEAD"],
        "description": "Subtle cache timing leak in polynomial evaluation for Galois field multiplications."
      },
      "vulnerable_apis": [
        "ring::aead"
      ],
      "summary": "ring subtle timing side-channel in GHASH computation",
      "advisory_url": "https://nvd.nist.gov/vuln/detail/CVE-2021-38562"
    }
  ]
}
